Food commodity ITEM,food_code,matched_affordability_description,match_score
SOLE,11111000,"Milk, whole (Includes 3.5% or 3.8% fat milk; leche fresca)",0.17495111616034226
SWARDFISH,26149120,"Swordfish, baked or broiled, fat added (Includes sauteed; fried with no coating; marlin; NS as to fat)",0.4526747303749347
TROUT,26151190,"Trout, smoked (Includes chub; cisco; lake herring; steelhead; whitefish)",1.0
TUNA,26153100,"Tuna, fresh, raw (Includes ahi; aku; bonito; sashimi)",1.0
TURBOT,24201000,"Turkey, NFS",0.2044159673747489
WHITING,26157140,"Whiting, coated, fried, made with oil (Includes fried, NS as to coating; NS as to fat; NS as to fat type)",0.5183645494689579
COD (F),26109170,"Cod, dried, salted",0.5519326704884561
FISH STICK (F),26100260,"Fish stick, patty or nugget from fast food",0.5414069142372631
HADDOCK (F),26117140,"Haddock, coated, fried (Includes fried, NS as to coating; burbot; cusk; hake; ling; monkfish; pollock; scrod)",0.643878999496053
HERRING (F),26119120,"Herring, baked or broiled, fat added (Includes sauteed; fried with no coating; alewife; milkfish; shad; NS as to fat)",0.5714641333680605
MACKEREL (F),26121180,"Mackerel, canned",1.0
MIXED FISH (F),26100190,"Fish, NS as to type, smoked",0.39107745545088146
POLLOCK (F),25221310,Polish sausage (Includes Kielbasa; all meats / poultry),0.24533848644878095
POLLOCK STICK (F),71205020,"Potato sticks, plain (Includes shoestrings; original)",0.5905664419451402
SALMON (F),26137190,"Salmon, smoked (Includes lox)",1.0
SOLE (F),11111000,"Milk, whole (Includes 3.5% or 3.8% fat milk; leche fresca)",0.17495111616034226
TROUT (F),26151190,"Trout, smoked (Includes chub; cisco; lake herring; steelhead; whitefish)",1.0
TUNA (F),26153100,"Tuna, fresh, raw (Includes ahi; aku; bonito; sashimi)",1.0
COD FISH STICK,26100260,"Fish stick, patty or nugget from fast food",0.47030079116509194
HAKE FISH STICK,26100260,"Fish stick, patty or nugget from fast food",0.5414069142372631
MAKEREL FISH STICK,26100260,"Fish stick, patty or nugget from fast food",0.5414069142372631
TUNA IN CAN,26153100,"Tuna, fresh, raw (Includes ahi; aku; bonito; sashimi)",1.0
BARNACLE,91611000,Popsicle (Includes all flavors; ice pop; push pop; popsicles with sticks),0.22407604183769825
KRILL,12350215,"Dill dip, light (Includes light cucumber dill dip; fat free; low fat; nonfat; reduced fat)",0.21410886412961053
LOBSTER,26311160,"Lobster, steamed or boiled (Includes spiny lobster; rock lobster)",0.5654507592910681
MUSSELS,26313100,"Mussels, raw",1.0
CUTTLEFISH,27150210,Fish sauce (Includes Bagoong; shrimp sauce),0.3705916594679093
OCTOPUS,26205160,"Octopus, steamed",0.6137855977017918
SQUID,26213190,"Squid, canned (Includes calamares en su tinta, squid in its own ink)",1.0
PRAWNS/SHRIMPS,26319170,"Shrimp, dried",1.0
OCTOPUS (F),26205160,"Octopus, steamed",0.6137855977017918
PRAWNS/SHRIMPS (F),26319170,"Shrimp, dried",1.0
